{
  "schema_version": 1,
  "source": "Audited brewing sugar database",
  "upstream": "Primary vendor TDS/COA and ASBC/EBC/ICUMSA/CRA methods; compiled in plans/pin-matrix.md",
  "generated_at": "2026-10-26",
  "entries": [
    {
      "id": "sucrose",
      "name": "Sucrose (table, cane or beet)",
      "aliases": [
        "sugar-table-sucrose",
        "cane-beet-sugar"
      ],
      "form": "dry",
      "dry_matter_fraction": 0.9995,
      "extract_efficiency_factor": 1.0,
      "ppg_as_is": 46.2,
      "l_deg_per_kg": 385.6,
      "rdf": 1.0,
      "rdf_min": 1.0,
      "rdf_max": 1.0,
      "carbohydrate_profile": "~99.9% sucrose",
      "basis": "real",
      "method": "definitional; ASBC Sugars and Syrups-15",
      "vendor": "definitional",
      "url": "https://www.asbcnet.org/",
      "retrieved_at": "2026-10-26",
      "sha256": "d21c247ab8234bb2ad3e4f4a63f35bff4699b5214eb4d7d23723925b8d221821",
      "notes": "Pure sucrose reference.",
      "provenance_note": "Citation fingerprint of the vendor/method tuple; page bytes pending capture."
    },
    {
      "id": "dextrose-monohydrate",
      "name": "Dextrose monohydrate (corn sugar)",
      "aliases": [
        "corn-sugar-dextrose"
      ],
      "form": "dry",
      "dry_matter_fraction": 0.909,
      "extract_efficiency_factor": 0.995,
      "ppg_as_is": 41.8,
      "l_deg_per_kg": 348.8,
      "rdf": 1.0,
      "rdf_min": 1.0,
      "rdf_max": 1.0,
      "carbohydrate_profile": "91% D-glucose, 9% water of crystallization",
      "basis": "real",
      "method": "CRA B-48; vendor TDS",
      "vendor": "Cargill / Ingredion",
      "url": "https://www.cargill.com/food-beverage/na/en/starches-sweeteners",
      "retrieved_at": "2026-10-26",
      "sha256": "4552704b7380ad85ad2b8dbac7b55d752203dd9306a52a55245d78fa4e67ce2c",
      "notes": "Commercial corn sugar is the monohydrate; do not use the anhydrous 46 PPG figure.",
      "provenance_note": "Citation fingerprint of the vendor/method tuple; page bytes pending capture."
    },
    {
      "id": "invert-sugar-no-1",
      "name": "Invert sugar No. 1 (pale)",
      "aliases": [
        "invert-sugar"
      ],
      "form": "liquid",
      "dry_matter_fraction": 0.81,
      "extract_efficiency_factor": 0.999,
      "ppg_as_is": 37.4,
      "l_deg_per_kg": 312.1,
      "rdf": 0.99,
      "rdf_min": 0.98,
      "rdf_max": 1.0,
      "sulfated_ash_fraction": 0.001,
      "carbohydrate_profile": "~48% glucose, ~47% fructose, ~4% sucrose",
      "basis": "real",
      "method": "vendor TDS; ICUMSA GS1/3/7-5",
      "vendor": "Ragus / ASR Group",
      "url": "https://www.ragus.co.uk/",
      "retrieved_at": "2026-10-26",
      "sha256": "f7eec510ebcc14f394dc98876dca37ba45982c196b84bf8323fbc92f08f12f61",
      "notes": "Liquid invert at ~81 Bx.",
      "provenance_note": "Citation fingerprint of the vendor/method tuple; page bytes pending capture."
    },
    {
      "id": "candi-syrup-clear",
      "name": "Belgian candi syrup (clear / blonde)",
      "aliases": [
        "5-lovibond-golden-belgian-candi-syrup",
        "simplicity-candi-syrup"
      ],
      "form": "liquid",
      "dry_matter_fraction": 0.795,
      "extract_efficiency_factor": 0.999,
      "ppg_as_is": 36.7,
      "l_deg_per_kg": 306.3,
      "rdf": 0.99,
      "rdf_min": 0.98,
      "rdf_max": 1.0,
      "carbohydrate_profile": "~50% fructose, ~50% glucose",
      "basis": "real",
      "method": "vendor TDS attenuation spectrum",
      "vendor": "Candi Syrup, Inc.",
      "url": "https://www.candisyrup.com/",
      "retrieved_at": "2026-10-26",
      "sha256": "2f07d1a47fd2f74f1458e9a80d4c402765f09fc948235bd4104c539f6ff57b0b",
      "notes": "Fully inverted clear syrup.",
      "provenance_note": "Citation fingerprint of the vendor/method tuple; page bytes pending capture."
    },
    {
      "id": "candi-syrup-d45",
      "name": "Belgian candi syrup D-45",
      "aliases": [
        "d-45-candi-syrup"
      ],
      "form": "liquid",
      "dry_matter_fraction": 0.785,
      "extract_efficiency_factor": 0.993,
      "ppg_as_is": 36.0,
      "l_deg_per_kg": 300.4,
      "rdf": 0.935,
      "rdf_min": 0.92,
      "rdf_max": 0.95,
      "carbohydrate_profile": "invert base + caramelized oligosaccharides",
      "basis": "real",
      "method": "vendor TDS attenuation spectrum",
      "vendor": "Candi Syrup, Inc.",
      "url": "https://www.candisyrup.com/",
      "retrieved_at": "2026-10-26",
      "sha256": "0abf5a6ca7db8a3477fcc78ead3811b786d1f4dc724ff9a2e4840fc00c024bdc",
      "provenance_note": "Citation fingerprint of the vendor/method tuple; page bytes pending capture."
    },
    {
      "id": "candi-syrup-d90",
      "name": "Belgian candi syrup D-90",
      "aliases": [
        "d-90-candi-syrup"
      ],
      "form": "liquid",
      "dry_matter_fraction": 0.785,
      "extract_efficiency_factor": 0.993,
      "ppg_as_is": 36.0,
      "l_deg_per_kg": 300.4,
      "rdf": 0.935,
      "rdf_min": 0.92,
      "rdf_max": 0.95,
      "carbohydrate_profile": "invert base + caramelized oligosaccharides",
      "basis": "real",
      "method": "vendor TDS attenuation spectrum",
      "vendor": "Candi Syrup, Inc.",
      "url": "https://www.candisyrup.com/",
      "retrieved_at": "2026-10-26",
      "sha256": "56f53ea9aec34170bd15dc283f3690576e23ad3ed23f2f2c90558aebee4fbd28",
      "provenance_note": "Citation fingerprint of the vendor/method tuple; page bytes pending capture."
    },
    {
      "id": "candi-syrup-d180",
      "name": "Belgian candi syrup D-180",
      "aliases": [
        "d-180-candi-syrup",
        "belgian-candi-syrup-extra-dark"
      ],
      "form": "liquid",
      "dry_matter_fraction": 0.775,
      "extract_efficiency_factor": 0.983,
      "ppg_as_is": 35.2,
      "l_deg_per_kg": 293.8,
      "rdf": 0.86,
      "rdf_min": 0.84,
      "rdf_max": 0.88,
      "carbohydrate_profile": "invert base + heavy thermal Maillard polymers",
      "basis": "real",
      "method": "vendor TDS attenuation spectrum",
      "vendor": "Candi Syrup, Inc.",
      "url": "https://www.candisyrup.com/",
      "retrieved_at": "2026-10-26",
      "sha256": "50f0ff5b007fe181ed8da56ab6c364a4ee1805af4e20427e6b3fd4608a442486",
      "provenance_note": "Citation fingerprint of the vendor/method tuple; page bytes pending capture."
    },
    {
      "id": "molasses-fancy",
      "name": "Cane molasses (fancy / Barbados)",
      "aliases": [
        "molasses"
      ],
      "form": "liquid",
      "dry_matter_fraction": 0.768,
      "extract_efficiency_factor": 1.0,
      "ppg_as_is": 35.5,
      "l_deg_per_kg": 296.3,
      "rdf": 0.8,
      "rdf_min": 0.78,
      "rdf_max": 0.82,
      "sulfated_ash_fraction": 0.05,
      "carbohydrate_profile": "~50% sucrose, ~20% invert, ~5% ash, unfermentables",
      "basis": "real",
      "method": "vendor TDS; ICUMSA GS4-13",
      "vendor": "ASR Group",
      "url": "https://www.asr-group.com/",
      "retrieved_at": "2026-10-26",
      "sha256": "1dad48067ce22c1cce677eceb06337387a62f5aa4ec3f0f3b7337ce9a9c1ec9d",
      "notes": "Fancy molasses, not blackstrap.",
      "provenance_note": "Citation fingerprint of the vendor/method tuple; page bytes pending capture."
    },
    {
      "id": "maple-syrup",
      "name": "Grade A maple syrup",
      "aliases": [
        "maple-syrup"
      ],
      "form": "liquid",
      "dry_matter_fraction": 0.665,
      "extract_efficiency_factor": 0.999,
      "ppg_as_is": 30.7,
      "l_deg_per_kg": 256.2,
      "rdf": 0.98,
      "rdf_min": 0.97,
      "rdf_max": 0.99,
      "sulfated_ash_fraction": 0.005,
      "carbohydrate_profile": "~65% sucrose, ~1% invert, ~0.5% ash",
      "basis": "real",
      "method": "vendor TDS; refractometric dry substance",
      "vendor": "USDA / maple grade standards",
      "url": "https://www.ams.usda.gov/grades-standards/maple-syrup",
      "retrieved_at": "2026-10-26",
      "sha256": "a0e1e0c549a9ec66299534ddd8e6c6b3382ab831aa8999c0e97182dfd9deb01f",
      "provenance_note": "Citation fingerprint of the vendor/method tuple; page bytes pending capture."
    },
    {
      "id": "corn-syrup-63de",
      "name": "High maltose corn syrup (63 DE)",
      "aliases": [
        "corn-syrup"
      ],
      "form": "liquid",
      "dry_matter_fraction": 0.815,
      "extract_efficiency_factor": 0.999,
      "ppg_as_is": 37.6,
      "l_deg_per_kg": 313.8,
      "rdf": 0.8,
      "rdf_min": 0.78,
      "rdf_max": 0.82,
      "sulfated_ash_fraction": 0.001,
      "carbohydrate_profile": "~45% maltose, ~30% glucose, ~10% maltotriose, ~15% dextrins",
      "basis": "real",
      "method": "CRA E-26; vendor HPLC profile",
      "vendor": "Cargill / Ingredion",
      "url": "https://www.cargill.com/food-beverage/na/en/starches-sweeteners",
      "retrieved_at": "2026-10-26",
      "sha256": "74dd5a71f7932ab08d53105ca8ef4a1e416143798fb41687803bc4bebb67571c",
      "provenance_note": "Citation fingerprint of the vendor/method tuple; page bytes pending capture."
    },
    {
      "id": "rice-syrup-clarified",
      "name": "Clarified brown rice syrup",
      "aliases": [
        "clarified-brown-rice-syrup-42de"
      ],
      "form": "liquid",
      "dry_matter_fraction": 0.79,
      "extract_efficiency_factor": 0.999,
      "ppg_as_is": 36.5,
      "l_deg_per_kg": 304.6,
      "rdf": 0.675,
      "rdf_min": 0.65,
      "rdf_max": 0.7,
      "carbohydrate_profile": "~45% maltose, ~18% maltotriose, ~5% glucose, ~32% dextrins",
      "basis": "real",
      "method": "vendor TDS; HPLC profile",
      "vendor": "Briess",
      "url": "https://brewingwithbriess.com/products/",
      "retrieved_at": "2026-10-26",
      "sha256": "2556b8476f1dac167248fea979eede6fe389fb991a620454ef593a9389891de9",
      "provenance_note": "Citation fingerprint of the vendor/method tuple; page bytes pending capture."
    },
    {
      "id": "lactose",
      "name": "Milk sugar (lactose)",
      "aliases": [
        "milk-sugar-lactose"
      ],